{
  "calibration_scope": "single_domain_mechanical_calibration",
  "capability_id": "CAPABILITY-IDENTITY-ACCESS",
  "coordinator": {
    "agent_uuid": "38d55885-5785-4da7-b4a7-94ca65e652e5",
    "designation": "CAP-COORD",
    "implementation": "deterministic"
  },
  "decision_authority": "human",
  "effect": "validation_and_routing_only",
  "expected_designations": [
    "CAP-RISK"
  ],
  "extra_designations": [],
  "fitness_claim": "mechanical_coordination_only",
  "generated_at": "2026-08-01T18:00:00Z",
  "integrity": {
    "input_hash": "sha256:9ea90fb95dadc4617e8dab696819edf71d30c828d64e9b607f2a9ed8a1ae2be1",
    "manifest_hash": "sha256:f3b575341961036adfebe25e8467ab0053ef916005e9516277846e9922e7a263"
  },
  "manifest_id": "fb399392-2368-543f-9eec-d5f8f8c529ae",
  "manifest_version": "1.0.0",
  "missing_designations": [],
  "partial_input_authorization": null,
  "preserved_conflicts": [],
  "received_inputs": [
    {
      "artifact_id": "a5ada795-db2f-5625-aed9-1b619411be17",
      "artifact_type": "capability-risk-posture",
      "compatibility": "compatible",
      "designation": "CAP-RISK",
      "freshness": "fresh",
      "lifecycle_state": "complete",
      "output_hash": "sha256:b56be7afa96e29b2106b8faad851688844b1bcfdbb9b706c3d1ffcbfd57ed783"
    }
  ],
  "review_completeness": {
    "expected": 1,
    "fraction": 1.0,
    "valid": 1
  },
  "routing": {
    "consumer": "CAP-SYNTH",
    "state": "ready_for_cap_synth",
    "synthesis_dispatch_permitted": true
  },
  "traceability": [
    {
      "evidence_refs": [],
      "record_id": "DC-001",
      "record_kind": "decision_request",
      "source_artifact_id": "a5ada795-db2f-5625-aed9-1b619411be17"
    },
    {
      "evidence_refs": [
        "UDS-0001"
      ],
      "record_id": "FINDING-001",
      "record_kind": "finding",
      "source_artifact_id": "a5ada795-db2f-5625-aed9-1b619411be17"
    },
    {
      "evidence_refs": [
        "1e27ed34-d9a5-5309-a876-ab02af8b7d13"
      ],
      "record_id": "RISK-001",
      "record_kind": "risk",
      "source_artifact_id": "a5ada795-db2f-5625-aed9-1b619411be17"
    }
  ],
  "validation": {
    "compatibility": "passed",
    "conflict_preservation": "passed",
    "freshness": "passed",
    "identity": "passed",
    "integrity": "passed",
    "schema": "passed"
  }
}
